{
  "$schema": "./pyrito-brand.schema.json",
  "spec": "pyrito.brand/1.0",
  "meta": {
    "brand": "Pyrito",
    "version": "1.2.0",
    "status": "canonical",
    "updated": "2026-08-15",
    "source_of_truth": true,
    "description": "Machine-readable identity, color, typography, and application rules for the independent Pyrito brand."
  },
  "identity": {
    "name": "Pyrito",
    "mode": "standalone",
    "positioning": "Apps, AI skills, products, automation, and intelligent tooling.",
    "signature": {
      "primary": "d20_plus_pyrito_wordmark",
      "subline": "none",
      "endorsement": "none",
      "wordmark_text": "Pyrito",
      "wordmark_case": "title_case",
      "mark_asset": "pyrito-d20.svg"
    },
    "mark": {
      "name": "D20",
      "type": "geometric_polyhedral_mark",
      "colors_are_fixed": true,
      "edge_color_token": "edge-cyan",
      "internal_fill_tokens": [
        "facet-mid",
        "teal-700",
        "abyss"
      ],
      "redraw_or_recolor": "prohibited"
    }
  },
  "color": {
    "tokens": {
      "ink": {
        "hex": "#0B0F0E",
        "role": "primary_dark_mode_surface",
        "usage": [
          "application_canvas",
          "navigation",
          "product_chrome",
          "high_contrast_working_surface"
        ]
      },
      "abyss": {
        "hex": "#07262B",
        "role": "deep_brand_ground",
        "usage": [
          "brand_panels",
          "hero_fields",
          "branded_depth"
        ]
      },
      "teal-50": {
        "hex": "#DAE9E6",
        "role": "lightest_teal_tint",
        "usage": [
          "soft_surface",
          "subtle_highlight"
        ]
      },
      "teal-100": {
        "hex": "#97C4BD",
        "role": "light_teal",
        "usage": [
          "secondary_data",
          "quiet_accent"
        ]
      },
      "teal-300": {
        "hex": "#5BA89A",
        "role": "supporting_teal",
        "usage": [
          "secondary_data",
          "supporting_state"
        ]
      },
      "teal": {
        "hex": "#1F7A82",
        "role": "primary_accent",
        "usage": [
          "primary_action",
          "link",
          "selection",
          "focus",
          "primary_data_series"
        ]
      },
      "teal-700": {
        "hex": "#0F4A52",
        "role": "deep_teal",
        "usage": [
          "layered_brand_surface",
          "dark_teal_detail"
        ]
      },
      "ember": {
        "hex": "#F86B3C",
        "role": "sparse_emphasis_accent",
        "usage": [
          "alert",
          "deliberate_attention",
          "single_warm_moment"
        ]
      },
      "edge-cyan": {
        "hex": "#46E5DA",
        "role": "d20_linework_only",
        "usage": [
          "d20_mark_linework"
        ]
      },
      "facet-mid": {
        "hex": "#0B333A",
        "role": "d20_internal_facet",
        "usage": [
          "d20_mark_internal_fill"
        ]
      },
      "off-white": {
        "hex": "#F4F6F5",
        "role": "primary_text_on_dark",
        "usage": [
          "dark_surface_text",
          "inverse_wordmark"
        ]
      },
      "white": {
        "hex": "#FFFFFF",
        "role": "light_surface",
        "usage": [
          "light_canvas"
        ]
      }
    },
    "systems": {
      "dark_mode": {
        "canvas": "ink",
        "brand_depth": "abyss",
        "text": "off-white",
        "action": "teal",
        "emphasis": "ember"
      },
      "light_mode": {
        "canvas": "white",
        "text": "ink",
        "action": "teal",
        "emphasis": "ember"
      },
      "core_ramp": [
        "teal-50",
        "teal-100",
        "teal-300",
        "teal",
        "teal-700",
        "abyss"
      ],
      "allowed_general_accents": [
        "teal",
        "ember"
      ],
      "restricted_mark_colors": [
        "edge-cyan",
        "facet-mid"
      ]
    }
  },
  "typography": {
    "families": {
      "sans": {
        "name": "Cal Sans UI",
        "role": "body_and_interface",
        "fallbacks": [
          "ui-sans-serif",
          "system-ui",
          "sans-serif"
        ]
      },
      "heading": {
        "name": "Cal Sans Heading",
        "role": "display_headings",
        "fallback_token": "sans"
      },
      "mono": {
        "name": "Paper Mono",
        "role": "technical_content_only",
        "fallbacks": [
          "ui-monospace",
          "SFMono-Regular",
          "Menlo",
          "Monaco",
          "Consolas",
          "monospace"
        ]
      }
    },
    "css_stacks": {
      "--font-sans": "\"Cal Sans UI\", ui-sans-serif, system-ui, sans-serif",
      "--font-heading": "\"Cal Sans Heading\", var(--font-sans)",
      "--font-mono": "\"Paper Mono\", ui-monospace, SFMono-Regular, Menlo, Monaco, Consolas, monospace"
    },
    "application": {
      "body": "sans",
      "interface": "sans",
      "headings": "heading",
      "code": "mono",
      "identifiers": "mono",
      "technical_content": "mono"
    }
  },
  "logo_application": {
    "background_variants": {
      "on_white": {
        "wordmark": "ink",
        "mark": "fixed"
      },
      "on_ink": {
        "wordmark": "off-white",
        "mark": "fixed"
      },
      "on_abyss": {
        "wordmark": "off-white",
        "mark": "fixed"
      }
    },
    "compact_use": "Use the D20 alone for favicons, app icons, and space-constrained product contexts.",
    "full_use": "Use the D20 with the Pyrito wordmark for primary brand signatures.",
    "asset_policy": "Use the supplied master asset. Do not approximate or regenerate the mark."
  },
  "surface_lockups": {
    "system": "register",
    "status": "canonical",
    "surfaces": [
      "wiki",
      "ops",
      "design"
    ],
    "variable": "surface_identifier",
    "fixed_components": {
      "mark": "d20_fixed",
      "wordmark": {
        "text": "Pyrito",
        "font_token": "heading",
        "case": "title_case"
      },
      "identifier": {
        "font_token": "mono",
        "case": "uppercase"
      },
      "rule": {
        "color_token": "teal",
        "position": "below_wordmark"
      },
      "terminal_square": {
        "color_token": "ember",
        "position": "after_identifier"
      }
    },
    "variants": {
      "light": {
        "backgrounds": [
          "white",
          "light_surface"
        ],
        "wordmark_and_identifier": "ink"
      },
      "dark": {
        "backgrounds": [
          "ink",
          "abyss"
        ],
        "wordmark_and_identifier": "off-white"
      }
    },
    "assets": {
      "wiki": {
        "light": "assets/lockups/pyrito-wiki-register-light.svg",
        "dark": "assets/lockups/pyrito-wiki-register-dark.svg"
      },
      "ops": {
        "light": "assets/lockups/pyrito-ops-register-light.svg",
        "dark": "assets/lockups/pyrito-ops-register-dark.svg"
      },
      "design": {
        "light": "assets/lockups/pyrito-design-register-light.svg",
        "dark": "assets/lockups/pyrito-design-register-dark.svg"
      }
    },
    "asset_policy": "Use the supplied Register SVG that matches the surface and background. Do not reconstruct or rearrange the lockup."
  },
  "rules": [
    {
      "id": "identity.standalone",
      "level": "must",
      "scope": "all",
      "instruction": "Present Pyrito as an independent, standalone brand."
    },
    {
      "id": "identity.no-endorsement",
      "level": "must_not",
      "scope": "logo_and_copy",
      "instruction": "Add a parent-brand endorsement, attribution line, or ownership subline."
    },
    {
      "id": "identity.no-subline",
      "level": "must_not",
      "scope": "primary_logo",
      "instruction": "Add descriptive, ownership, or endorsement text to the primary Pyrito signature; approved Register surface identifiers are the only governed exception."
    },
    {
      "id": "identity.master-mark",
      "level": "must",
      "scope": "logo",
      "instruction": "Use pyrito-d20.svg as the master D20 mark."
    },
    {
      "id": "identity.fixed-mark-colors",
      "level": "must_not",
      "scope": "logo",
      "instruction": "Recolor, redraw, distort, crop, add effects to, or alter the internal geometry of the D20."
    },
    {
      "id": "surface.register-canonical",
      "level": "must",
      "scope": "surface_lockups",
      "instruction": "Use the Register system for every Pyrito surface lockup."
    },
    {
      "id": "surface.approved-names",
      "level": "must",
      "scope": "surface_lockups",
      "instruction": "Use only Wiki, Ops, or Design as the approved surface identifier."
    },
    {
      "id": "surface.identifier-uppercase",
      "level": "must",
      "scope": "surface_lockups",
      "instruction": "Set the surface identifier in uppercase."
    },
    {
      "id": "surface.identifier-mono",
      "level": "must",
      "scope": "surface_lockups",
      "instruction": "Set the surface identifier in Paper Mono as a technical product identifier."
    },
    {
      "id": "surface.fixed-details",
      "level": "must",
      "scope": "surface_lockups",
      "instruction": "Keep the Teal rule and Ember terminal square fixed across Wiki, Ops, and Design."
    },
    {
      "id": "surface.no-alternate-treatment",
      "level": "must_not",
      "scope": "surface_lockups",
      "instruction": "Use divider-rail, badge, tab, or other alternate surface-name treatments as canonical Pyrito lockups."
    },
    {
      "id": "color.ink-surface",
      "level": "must",
      "scope": "dark_mode",
      "instruction": "Use Ink as the primary application surface."
    },
    {
      "id": "color.abyss-depth",
      "level": "should",
      "scope": "brand_surfaces",
      "instruction": "Use Abyss for deep branded grounds and depth, not as the default application canvas."
    },
    {
      "id": "color.teal-leads",
      "level": "must",
      "scope": "interaction",